{
  "tone": "Informative, practical, and empowering",
  "topic": "How to invest on AI winner stocks from France?",
  "slug": "how-to-invest-on-ai-winner-stocks-from-france",
  "angle": "Navigating the complexities of investing in AI winner stocks from France requires understanding the unique tax implications and investment vehicle restrictions for expats. This content will guide expats on how to legally and effectively invest in AI stocks while minimizing tax burdens and maximizing opportunities within the French financial system.",
  "hooks": [
    "Dreaming of investing in AI's biggest winners but stuck in France? Don't let tax rules and investment restrictions hold you back.",
    "NVIDIA, Microsoft, Alphabet – can you even invest in these AI giants from France? We break down the PEA rules and tax implications for expats.",
    "Unlock the potential of AI stocks while living in France. Discover how to navigate the system and make your money grow, tax-efficiently."
  ],
  "secondary_keywords": [
    "investing in AI ETFs France",
    "tax on stocks France expat",
    "French stock market AI",
    "digital nomad investing France",
    "expat financial advice France"
  ],
  "instagram_visual_concept": "A visually appealing infographic comparing PEA-eligible and non-eligible AI stocks, with clear icons representing France, money, and AI. Use a bright, tech-forward color palette.",
  "pain_points": [
    "Confusion about French capital gains tax on foreign investments.",
    "Ineligibility of major US AI stocks in the French PEA.",
    "Difficulty in finding suitable AI investments within the EU/EEA.",
    "Understanding the tax treaty implications for US expats.",
    "Lack of clear, actionable guidance for expats on AI investing."
  ],
  "target_audience": "English-speaking expats, international workers, and digital nomads living in France with an interest in technology and stock market investments.",
  "linkedin_angle": "As an expat in France, the allure of AI stocks is undeniable. But navigating the French tax system and the specific rules of the PEA can feel like deciphering a foreign language. This article breaks down how to strategically invest in AI winners from France, focusing on the practicalities of the PEA, tax implications, and alternative investment avenues. #ExpatFinance #FranceInvesting #AIStocks #PEA #PersonalFinance #TechInvestment",
  "word_count_blog": 1500,
  "blog_outline": [
    {
      "section": "Introduction: The AI Investment Boom and Why Expats in France Need a Strategy",
      "key_points": [
        "Brief overview of AI's market dominance.",
        "The specific challenges expats in France face when investing.",
        "Thesis: This guide will help you invest in AI winners from France, legally and tax-efficiently."
      ]
    },
    {
      "section": "Understanding French Taxation on Investments",
      "key_points": [
        "Overview of French capital gains tax (30% flat rate, incl. social charges).",
        "How the French-American tax treaty impacts US expats (taxation in France).",
        "Expat tax obligations in both France and home country (e.g., US).",
        "Example: Tax implications of selling US-based AI stocks."
      ]
    },
    {
      "key_points": [
        "What is a PEA and its tax benefits (exemption after 5 years).",
        "Eligibility criteria: EU/EEA registered companies.",
        "Why major US AI stocks (NVIDIA, Microsoft, Alphabet) are NOT PEA-eligible.",
        "How to open and fund a PEA as a French resident."
      ],
      "section": "The PEA (Plan d'Epargne en Actions): Your Tax-Advantaged French Investment Vehicle"
    },
    {
      "key_points": [
        "Option 1: Direct investment in PEA-eligible European AI or tech companies (if available).",
        "Option 2: Investing in AI-focused ETFs or mutual funds that ARE PEA-eligible.",
        "Option 3: Using a standard 'compte-titres' for non-EU stocks (higher tax implications).",
        "Pros and cons of each option regarding risk, return, and tax."
      ],
      "section": "Investing in AI Stocks: Options for Expats in France"
    },
    {
      "section": "Identifying Potential AI Winner Stocks (Within PEA or Compte-Titres)",
      "key_points": [
        "Criteria for identifying AI companies (revenue from AI, R&D, market position).",
        "Examples of European companies with AI exposure (mentioning sector rather than specific stock picks).",
        "How to research AI ETFs and funds available on PEA.",
        "Due diligence: looking beyond the hype."
      ]
    },
    {
      "section": "Actionable Steps and Best Practices",
      "key_points": [
        "Step-by-step guide to opening a PEA.",
        "How to research and select investments.",
        "Importance of diversification.",
        "When to consult a financial advisor specializing in expat finance.",
        "Recap of key tax considerations and how to optimize."
      ]
    },
    {
      "key_points": [
        "Summary of the strategies discussed.",
        "Encouragement for expats to take control of their investments.",
        "Final advice on long-term AI investment from France."
      ],
      "section": "Conclusion: Investing for the Future, French Style"
    }
  ],
  "formats": [
    "blog",
    "linkedin",
    "instagram"
  ],
  "target_keywords": [
    "investing AI stocks France",
    "AI stocks expat France",
    "PEA eligible AI stocks",
    "French tax on US stocks",
    "investing in tech stocks France"
  ]
}