{
  "angle": "Unlock the tax advantages of France's LMNP status for furnished rentals as an expat, navigating the complexities of the micro-BIC and Régime Réel to maximize your rental income and minimize your tax burden.",
  "target_audience": "English-speaking expats living in France, including those who own or are considering purchasing furnished rental properties.",
  "target_keywords": [
    "LMNP tax regime France expats",
    "expat furnished rental tax France",
    "France LMNP for non-residents"
  ],
  "secondary_keywords": [
    "fiscalité location meublée non professionnelle expatrié",
    "France LMNP tax benefits foreigners",
    "régime fiscal LMNP pour non-résidents français",
    "investing in French property LMNP expat",
    "French rental income tax for expats"
  ],
  "topic": "LMNP regime fiscal expatriés",
  "hooks": [
    "Unlock significant tax savings on your French rental income: An expat's guide to the LMNP regime.",
    "Renting out property in France? Don't let unfamiliar tax laws eat into your profits. Discover the LMNP advantage for expats.",
    "France's LMNP status: Is it your golden ticket to tax-efficient property rental? Find out how to leverage it as an expat."
  ],
  "pain_points": [
    "Expats struggling to understand French tax laws for rental income.",
    "Uncertainty about choosing between micro-BIC and Régime Réel.",
    "Confusion over new regulations affecting non-resident LMNP/LMP status.",
    "Fear of making costly tax declaration errors.",
    "Maximizing rental income while minimizing tax obligations."
  ],
  "instagram_visual_concept": "A visually appealing infographic that breaks down the core LMNP tax options (Micro-BIC vs. Regime Reel) with simple icons and clear benefit statements. Could also feature a carousel with tips for each regime and a final slide with a call to action to consult a tax advisor.",
  "linkedin_angle": "As an expat landlord in France, understanding the LMNP tax regime is crucial. Recent changes in how non-resident status is determined mean it's more important than ever to ensure you're optimizing your tax strategy. Swipe to see how you can benefit from deductibles and depreciation, potentially saving thousands.",
  "tone": "Informative, practical, and reassuring",
  "blog_outline": [
    {
      "key_points": [
        "Brief explanation of LMNP status.",
        "Why it's particularly relevant and attractive for expats investing in French property.",
        "Overview of the tax implications (BIC)."
      ],
      "section": "Introduction: What is LMNP and Why Should Expats Care?"
    },
    {
      "key_points": [
        "Detailed explanation of the micro-BIC regime: 50% or 71% flat-rate allowance.",
        "When micro-BIC is most beneficial.",
        "Detailed explanation of the Régime Réel: deducting actual expenses (depreciation, interest, repairs, etc.).",
        "The power of depreciation in reducing taxable income.",
        "When Régime Réel is more advantageous."
      ],
      "section": "Understanding Your LMNP Tax Options: Micro-BIC vs. Régime Réel"
    },
    {
      "key_points": [
        "Explanation of the previous rules for determining LMP vs. LMNP for non-residents (focus on French income).",
        "Explanation of the new rules and how worldwide income is now considered.",
        "The implications of these changes for expats and how to avoid unintended LMP status."
      ],
      "section": "Navigating the LMNP/LMP Distinction for Non-Residents: Key Changes"
    },
    {
      "key_points": [
        "Essential forms to complete (e.g., 2042-NR for non-residents).",
        "Where and how to declare.",
        "Importance of accurate record-keeping for Régime Réel.",
        "When to seek professional tax advice."
      ],
      "section": "Step-by-Step Guide to Declaring LMNP Income as an Expat"
    },
    {
      "key_points": [
        "Leveraging depreciation effectively.",
        "Considering classified tourist accommodation status.",
        "Potential tax benefits upon resale.",
        "Common pitfalls to avoid for expats."
      ],
      "section": "Maximizing Your LMNP Investment: Expert Tips"
    },
    {
      "key_points": [
        "Recap of key benefits and choices.",
        "Encouragement to act and optimize tax strategy.",
        "Call to action: consult a tax professional."
      ],
      "section": "Conclusion: Take Control of Your French Rental Property Taxes"
    }
  ],
  "formats": [
    "blog",
    "linkedin",
    "instagram"
  ],
  "slug": "lmnp-regime-fiscal-expatries",
  "word_count_blog": 1200
}