{
  "linkedin_angle": "France is a burgeoning AI hub, attracting significant international investment. As an expat, you have a unique opportunity to tap into this growth. Learn about the key players, the investment landscape, and how to navigate it successfully. #FranceAI #ExpatInvesting #TechInvestment #EuropeanAI",
  "blog_outline": [
    {
      "key_points": [
        "Overview of France's rapidly growing AI ecosystem (over 1000 startups, significant VC investment).",
        "Highlight France's position as a leading AI hub in Europe.",
        "Briefly mention the opportunity for foreign investors."
      ],
      "section": "Introduction: The French AI Revolution"
    },
    {
      "key_points": [
        "Government support and ambitious public policies (French Tech 2030, Bpifrance).",
        "Dynamic entrepreneurial fabric and successful startups (Mistral AI, Poolside, etc.).",
        "International investment interest (e.g., SoftBank's expansion)."
      ],
      "section": "Why Invest in French AI Now?"
    },
    {
      "key_points": [
        "Focus on key players and rising stars (e.g., Mistral AI, Artefact).",
        "Explain criteria for identifying potential winners (funding rounds, innovation, market leadership).",
        "Mention sectors within AI that are thriving in France (e.g., generative AI, data marketing)."
      ],
      "section": "Identifying Top French AI Companies"
    },
    {
      "key_points": [
        "Discuss accessible investment avenues (e.g., venture capital, public markets if applicable, specialized funds).",
        "Address potential hurdles for non-residents (legal, tax implications).",
        "Emphasize the importance of due diligence and risk assessment."
      ],
      "section": "How Expats Can Invest"
    },
    {
      "key_points": [
        "Importance of consulting tax professionals for compliance and optimization.",
        "Consideration of local market nuances.",
        "Tips for accessing investment opportunities (networking, platforms)."
      ],
      "section": "Navigating French Investment Landscape"
    },
    {
      "key_points": [
        "Recap of the opportunity for expats.",
        "Call to action: encourage further research and professional consultation.",
        "Reinforce the long-term potential of investing in French AI."
      ],
      "section": "Conclusion: Seizing the AI Opportunity in France"
    }
  ],
  "topic": "How to invest on AI world winner companies from france?",
  "formats": [
    "blog",
    "linkedin",
    "instagram"
  ],
  "hooks": [
    "France is becoming an AI powerhouse – here’s how expats can invest in its winning companies.",
    "Unlock the potential of French AI: A guide for expats looking to invest in Europe’s tech boom.",
    "AI innovation is booming in France. Discover how you can be part of it as an expat investor."
  ],
  "angle": "For expats in France, demystify how to invest in the booming French AI sector, focusing on identifying and capitalizing on high-growth AI companies within the French market.",
  "instagram_visual_concept": "A dynamic infographic showcasing the growth of AI startups in France, highlighting key companies like Mistral AI with their funding rounds and valuations. Include icons representing investment and technology. Overlay with a text ",
  "target_keywords": [
    "invest AI France expat",
    "French AI stocks",
    "investing in French startups"
  ],
  "slug": "how-to-invest-on-ai-world-winner-companies-from-france"
}