{
  "tone": "Informative and authoritative, yet accessible and practical.",
  "pain_points": [
    "Expats struggle to understand French property tax laws.",
    "Confusion over the best legal structure for owning and managing property in France.",
    "Fear of making costly mistakes due to lack of knowledge about SCI vs. LMNP.",
    "Difficulty in optimizing tax liabilities related to French real estate investments."
  ],
  "topic": "SCI holding vs LMNP France",
  "angle": "Navigating the complexities of French property investment, this content will clarify whether a SCI (Société Civile Immobilière) or LMNP (Loueur en Meublé Non Professionnel) status is the optimal structure for expats, focusing on tax efficiency and long-term wealth building.",
  "blog_outline": [
    {
      "key_points": [
        "Brief overview of the French property market for expats.",
        "Introducing SCI and LMNP as two primary structures.",
        "Highlighting the confusion expats face when choosing between them."
      ],
      "section": "Introduction: Understanding Your French Property Investment Options"
    },
    {
      "section": "What is a SCI?",
      "key_points": [
        "Explanation of SCI: purpose, structure, and common uses (shared ownership, estate planning).",
        "Taxation of SCI: Impôt sur le Revenu (IR) vs. Impôt sur les Sociétés (IS).",
        "Pros and cons of SCI for expats (e.g., flexibility, tax implications on dividends and capital gains)."
      ]
    },
    {
      "key_points": [
        "Explanation of LMNP status: focus on furnished rentals.",
        "Tax benefits of LMNP: amortization, 'micro-BIC' vs. 'régime réel'.",
        "Key considerations for LMNP (e.g., personal income tax, social contributions)."
      ],
      "section": "What is LMNP?"
    },
    {
      "key_points": [
        "Direct comparison based on key criteria: tax efficiency, administrative burden, flexibility, suitability for different investment goals (income vs. capital growth).",
        "Analyzing specific scenarios: buying property to live in vs. renting out, single owner vs. multiple owners.",
        "Impact of recent legislation (e.g., Loi de finances pour 2026) on both structures."
      ],
      "section": "Head-to-Head: SCI vs. LMNP for Expats"
    },
    {
      "key_points": [
        "Guidance on how to assess individual needs (financial goals, risk tolerance, family situation).",
        "When SCI might be preferable.",
        "When LMNP might be preferable.",
        "The possibility of combining structures or transitioning between them."
      ],
      "section": "Making the Right Choice: Key Factors to Consider"
    },
    {
      "section": "Actionable Steps and Expert Advice",
      "key_points": [
        "Checklist for expats before making a decision.",
        "Importance of seeking professional advice (tax advisor, legal expert).",
        "Resources for further information."
      ]
    },
    {
      "key_points": [
        "Recap of the main differences and decision-making factors.",
        "Empowering expats to make an informed choice for their French property investment."
      ],
      "section": "Conclusion: Securing Your Financial Future in France"
    }
  ],
  "formats": [
    "blog",
    "linkedin",
    "instagram"
  ],
  "slug": "sci-holding-vs-lmnp-france",
  "secondary_keywords": [
    "French property ownership for foreigners",
    "tax implications SCI France",
    "LMNP rental income tax",
    "expat guide French real estate",
    "investing in France as an expat"
  ],
  "linkedin_angle": "As an expat in France, choosing between a SCI and LMNP for your property investment is a critical decision with significant tax implications. Our latest analysis breaks down the key differences and helps you navigate the complexities of French real estate law, ensuring you optimize your returns and comply with regulations.",
  "hooks": [
    "Buying property in France? Don't get caught out by tax pitfalls – SCI or LMNP, which structure is right for you?",
    "Expat in France: Unlock the secrets to tax-efficient property investment with our SCI vs. LMNP breakdown.",
    "French property investment simplified: Discover if SCI or LMNP is your golden ticket to wealth building."
  ],
  "target_keywords": [
    "SCI vs LMNP France",
    "French property tax for expats",
    "investing in French real estate",
    "SCI fiscalité France",
    "LMNP status France"
  ],
  "instagram_visual_concept": "A split image: one side showing a stylized French chateau with legal documents (representing SCI), the other side showing a modern, furnished apartment with a calendar highlighting rental income (representing LMNP). Overlay text poses the core question: SCI or LMNP?"
}