{
  "formats": [
    "blog",
    "linkedin",
    "instagram"
  ],
  "secondary_keywords": [
    "French investment accounts for expats",
    "tax efficient ETFs France",
    "investing in France for foreigners",
    "PEA eligible ETFs",
    "CTO vs PEA France"
  ],
  "slug": "etf-optimization-pea-vs-pee-vs-per-vs-cto-most-profitable-indices-2026",
  "target_keywords": [
    "ETF France",
    "PEA vs CTO",
    "investing France expats",
    "French tax on ETFs",
    "best ETFs for French residents"
  ],
  "topic": "ETF optimization PEA vs PEE vs PER vs CTO most profitable indices 2026",
  "target_audience": "English-speaking foreigners (expats, international workers, digital nomads) living in France, with varying levels of financial literacy.",
  "word_count_blog": 1500,
  "linkedin_angle": "As an expat in France, choosing between a PEA, CTO, PEE, or PER for your ETF investments can significantly impact your net returns due to differing tax implications. My recent analysis revealed that prioritizing the PEA for long-term, diversified index ETFs (like MSCI World or S&P 500 via synthetic replication) can lead to substantial tax savings compared to a CTO, especially after the 5-year exemption threshold. However, the CTO remains crucial for non-European assets and flexibility. Understanding these nuances is key to optimizing your wealth in France.",
  "tone": "Informative, practical, and reassuring",
  "hooks": [
    "Navigating French investment accounts? Understand PEA, PEE, PER, and CTO to make your ETFs work harder.",
    "Expat in France: Unlock the most profitable ETF strategies by mastering the PEA, PEE, PER, and CTO.",
    "Don't let French taxes erode your ETF returns. Learn how PEA, PEE, PER, and CTO can boost your investment performance."
  ],
  "angle": "For expats in France, understanding the tax advantages and investment limitations of PEA, PEE, PER, and CTO is crucial for optimizing ETF investments and maximizing long-term returns.",
  "instagram_visual_concept": "Infographic comparing PEA, PEE, PER, and CTO side-by-side using icons and key stats (tax rate, investment limit, typical use case). Include a carousel highlighting top ETFs for PEA/CTO with performance data and TER.",
  "pain_points": [
    "Expat confusion about French investment accounts (PEA, PEE, PER, CTO)",
    "Uncertainty on which ETFs are most profitable within each account type",
    "Navigating French tax implications on capital gains and dividends from ETFs",
    "Maximizing long-term investment returns as a foreigner in France"
  ],
  "blog_outline": [
    {
      "key_points": [
        "Brief overview of the French investment landscape for expats.",
        "Introduce PEA, PEE, PER, and CTO as primary investment vehicles.",
        "Highlight the common goal: maximizing returns through optimized ETF choices.",
        "State the article's purpose: to clarify the differences and benefits of each vehicle for ETF investors."
      ],
      "section": "Introduction: Why ETF optimization matters for expats in France"
    },
    {
      "key_points": [
        "PEA (Plan d'épargne en Actions): Focus on tax benefits after 5 years, eligible investments (European focus, synthetic ETFs for global reach), and the €150,000 limit.",
        "CTO (Compte-Titres Ordinaire): Explain its broader investment scope, higher tax implications (PFU 31.4% or IR), and its role as a 'satellite' diversified account.",
        "PEE (Plan d'épargne entreprise): Describe as an employer-sponsored savings plan, often with company matching, and its distinct tax treatment.",
        "PER (Plan d'épargne retraite): Detail its long-term, retirement-focused nature, tax deductions on contributions, and taxation at withdrawal.",
        "Comparative table summarizing key features: tax, eligible assets, limits, and typical use cases."
      ],
      "section": "Understanding the Investment Vehicles: PEA, PEE, PER, and CTO"
    },
    {
      "key_points": [
        "When to prioritize PEA: Long-term growth, maximizing capital gains tax efficiency, using synthetic ETFs for global diversification within the PEA.",
        "When to use CTO: Accessing non-European ETFs, short-to-medium term investments, higher risk tolerance, or when PEA is maxed out.",
        "The role of PEE and PER: Leveraging employer benefits and retirement planning alongside core investment strategies.",
        "Example: How an expat might structure their ETF portfolio across these vehicles."
      ],
      "section": "ETF Optimization Strategies: Choosing the Right Vehicle for Your Goals"
    },
    {
      "key_points": [
        "Highlighting popular and high-performing indices: MSCI World, S&P 500, Nasdaq-100, etc.",
        "Mentioning specific, well-regarded ETFs (e.g., Amundi MSCI World, iShares S&P 500) and their eligibility for PEA/CTO.",
        "Discussing factors beyond performance: TER (Total Expense Ratio), assets under management (AUM), and UCITS compliance.",
        "Addressing the 'synthetic vs. physical replication' for PEA eligibility.",
        "Caveat: Past performance is not indicative of future results; focus on diversification and long-term strategy."
      ],
      "section": "Profitable Indices and ETFs for 2026 (Focus on PEA & CTO)"
    },
    {
      "key_points": [
        "Step 1: Assess your financial goals, time horizon, and risk tolerance.",
        "Step 2: Understand your eligibility and the rules for PEA, PEE, PER, and CTO.",
        "Step 3: Research specific ETFs suitable for your chosen vehicle(s).",
        "Step 4: Consider consulting a financial advisor familiar with expat taxation in France.",
        "Step 5: Regularly review and rebalance your portfolio."
      ],
      "section": "Actionable Steps for Expats: How to Optimize Your ETF Investments"
    },
    {
      "key_points": [
        "Recap the core differences and tax advantages.",
        "Reiterate the importance of aligning investment vehicles with personal financial goals.",
        "Final encouragement for proactive ETF optimization as an expat in France.",
        "Call to action: Encourage readers to start planning or review their current strategy."
      ],
      "section": "Conclusion: Key Takeaways for Maximizing Your Returns"
    }
  ]
}